{
  "skill": "meeting-synth",
  "decisions": [
    "Approved quarterly access review cadence for production AWS roles",
    "Agreed to defer vendor SOC report until Q3"
  ],
  "risks": [
    "Risk: stale IAM roles in legacy account",
    "Concern: incomplete control mapping for new SaaS tool"
  ],
  "action_items": [
    "Action: Draft ticket for IAM role cleanup in legacy account",
    "Follow-up: Run csf-crosswalk on new SaaS vendor questionnaire",
    "Todo: Update access control policy redline with MFA requirement"
  ],
  "proposed_tickets": [
    {
      "id": "AI-PROPOSED-001",
      "title": "Action: Draft ticket for IAM role cleanup in legacy account",
      "status": "ai_proposed",
      "assignee": "unassigned",
      "suggested_owner": "security-team",
      "rationale": "Derived from meeting action item: Action: Draft ticket for IAM role cleanup in legacy account",
      "description": "Action: Draft ticket for IAM role cleanup in legacy account\n\nSuggested owner: security-team\n\nDerived from meeting action item: Action: Draft ticket for IAM role cleanup in legacy account",
      "control_tags": [
        "CSF:ID.AM",
        "SOC2:CC3.2",
        "SOC2:CC6.1"
      ]
    },
    {
      "id": "AI-PROPOSED-002",
      "title": "Follow-up: Run csf-crosswalk on new SaaS vendor questionnaire",
      "status": "ai_proposed",
      "assignee": "unassigned",
      "suggested_owner": "security-team",
      "rationale": "Derived from meeting action item: Follow-up: Run csf-crosswalk on new SaaS vendor questionnaire",
      "description": "Follow-up: Run csf-crosswalk on new SaaS vendor questionnaire\n\nSuggested owner: security-team\n\nDerived from meeting action item: Follow-up: Run csf-crosswalk on new SaaS vendor questionnaire",
      "control_tags": [
        "CSF:ID.AM",
        "SOC2:CC3.2",
        "SOC2:CC6.1"
      ]
    },
    {
      "id": "AI-PROPOSED-003",
      "title": "Todo: Update access control policy redline with MFA requirement",
      "status": "ai_proposed",
      "assignee": "unassigned",
      "suggested_owner": "security-team",
      "rationale": "Derived from meeting action item: Todo: Update access control policy redline with MFA requirement",
      "description": "Todo: Update access control policy redline with MFA requirement\n\nSuggested owner: security-team\n\nDerived from meeting action item: Todo: Update access control policy redline with MFA requirement",
      "control_tags": [
        "CSF:ID.AM",
        "SOC2:CC3.2",
        "SOC2:CC6.1"
      ]
    }
  ],
  "control_tags": [
    "CSF:ID.AM",
    "CSF:DE.AE",
    "SOC2:CC3.2",
    "SOC2:CC6.1",
    "800-53:RA-5"
  ],
  "ticket_files": [
    "ticket-proposal-001.json",
    "ticket-proposal-002.json",
    "ticket-proposal-003.json",
    "ticket-proposal-004.json"
  ]
}